[
  {
    "text": "Which amino acid has a thiol side chain?",
    "options": ["Cysteine","Alanine","Glycine","Serine"],
    "correct": 0,
    "explanation": "Cysteine contains a thiol (–SH) side chain which can form disulfide bonds.",
    "source": { "name": "OpenStax Biology", "url": "https://openstax.org/details/books/biology-2e" },
    "tags": ["biochemistry","amino acids"],
    "difficulty": "easy"
  },
  {
    "text": "Which enzyme catalyzes the conversion of phosphoenolpyruvate (PEP) to pyruvate?",
    "options": ["Pyruvate kinase","Hexokinase","Phosphofructokinase-1","Pyruvate carboxylase"],
    "correct": 0,
    "explanation": "Pyruvate kinase catalyzes PEP to pyruvate in glycolysis.",
    "source": { "name": "AAMC Official Guide", "url": "https://students-residents.aamc.org/" },
    "tags": ["metabolism"],
    "difficulty": "medium"
  }
]
