[
  {
    "text": "Which neurotransmitter is most directly implicated in Parkinson's disease?",
    "options": [
      "GABA",
      "Dopamine (loss of dopaminergic neurons in substantia nigra)",
      "Acetylcholine",
      "Serotonin"
    ],
    "correct": 1,
    "explanation": "Parkinson's disease results from progressive degeneration of dopaminergic neurons in the substantia nigra pars compacta. These neurons project to the striatum (nigrostriatal pathway), and their loss disrupts motor control. Treatment: L-DOPA (dopamine precursor).",
    "tags": [
      "biological-psychology",
      "parkinson",
      "dopamine",
      "basal-ganglia"
    ],
    "difficulty": "easy"
  },
  {
    "text": "Broca's area damage results in:",
    "options": [
      "Wernicke's aphasia: fluent but meaningless speech",
      "Alexia: inability to read",
      "Agrammatism with intact phonology",
      "Broca's aphasia: nonfluent, halting speech production with intact comprehension"
    ],
    "correct": 3,
    "explanation": "Broca's area (left inferior frontal gyrus) is critical for speech production and grammar. Damage causes Broca's aphasia: labored, telegraphic speech (function words omitted) but relatively preserved comprehension. Wernicke's area damage (left temporal) causes fluent but nonsensical speech with poor comprehension.",
    "tags": [
      "language",
      "brocas-area",
      "aphasia"
    ],
    "difficulty": "medium"
  },
  {
    "text": "The Sapir-Whorf hypothesis (linguistic relativity) proposes that:",
    "options": [
      "Grammar is innate (Universal Grammar)",
      "Language acquisition follows a critical period determined by genetics",
      "Language influences or determines thought and perception of reality",
      "Thought is universal and independent of language"
    ],
    "correct": 2,
    "explanation": "Sapir-Whorf: the language we speak shapes how we think about and perceive the world. The strong version (linguistic determinism) claims language determines thought; the weak version (linguistic relativity) claims language influences but does not determine thought. Color perception studies provide mixed evidence.",
    "tags": [
      "language",
      "sapir-whorf",
      "linguistic-relativity"
    ],
    "difficulty": "medium"
  }
]