[
  {"text":"Weber's three components of social class (as opposed to Marx's two-class model) include:","options":["Race, gender, and age","Class (economic: wealth and income), Status (social prestige and honor), and Party (power: ability to achieve goals despite opposition)","Bourgeoisie, proletariat, and lumpenproletariat","Education, occupation, and religion only"],"correct":1,"explanation":"Max Weber's multidimensional stratification: (1) Class: economic position — ownership of property and market situation; (2) Status: social honor or prestige — not always aligned with economic class (e.g., a poor college professor may have high status); (3) Party: power — ability to achieve goals in competitive situations (political parties, organizations). Marx focused on economic class (means of production) as primary; Weber showed stratification is more complex and multidimensional.","tags":["sociology","social stratification","Weber"],"difficulty":"medium"},
  {"text":"The concept of 'resocialization' in total institutions occurs when:","options":["Individuals reinforce their existing social identities","Previous identity is systematically stripped away (mortification of self) and replaced with a new institutional identity — occurs in military boot camps, prisons, residential psychiatric facilities, and cults","Individuals freely choose to adopt new social roles","Cultural transmission occurs through informal learning"],"correct":1,"explanation":"Goffman (Asylums, 1961): total institutions resocialize through mortification — degradation ceremonies, stripping personal identity markers (civilian clothing replaced with uniform, name replaced with number), loss of autonomy over daily schedule. Purpose: create conformity to institutional demands. Analogous processes in medical education (medical students learning to depersonalize to cope) and religious conversion experiences.","tags":["sociology","resocialization","Goffman"],"difficulty":"medium"},
  {"text":"Negative symptoms of schizophrenia most likely result from dysfunction in which brain region?","options":["Amygdala (fear processing)","Prefrontal cortex — hypofrontality (reduced metabolic activity in PFC) is associated with negative symptoms such as flat affect, avolition, and alogia","Hippocampus (memory formation)","Cerebellum (motor coordination)"],"correct":1,"explanation":"Schizophrenia neurobiology: positive symptoms (hallucinations, delusions) — linked to excess dopamine in mesolimbic pathway; treated by D2 receptor blockers. Negative symptoms (flat affect, avolition, alogia, anhedonia) — linked to dopamine deficiency in mesocortical pathway (PFC hypofrontality seen on PET). Glutamate hypothesis: NMDA receptor hypofunction (explains both positive and negative symptoms). Structural: enlarged ventricles, reduced gray matter volume in temporal/frontal regions.","tags":["abnormal psychology","schizophrenia","neuroscience"],"difficulty":"hard"},
  {"text":"In operant conditioning, which schedule of reinforcement produces the slowest rate of extinction?","options":["Continuous reinforcement (every response rewarded)","Fixed ratio schedule","Variable ratio schedule — produces the greatest resistance to extinction because unpredictability prevents the organism from learning that reinforcement has stopped","Fixed interval schedule"],"correct":2,"explanation":"Partial reinforcement extinction effect (PREE): behaviors reinforced intermittently are much more resistant to extinction than continuously reinforced behaviors. Why: under continuous reinforcement, any non-reinforcement signals extinction immediately. Under variable ratio: organism can't tell if it's just a bad run or true extinction — keeps responding. Gambling behavior: quintessential VR schedule, explaining extreme persistence even when losing. VR > FI > FR in extinction resistance.","tags":["learning","operant conditioning","reinforcement schedules","extinction"],"difficulty":"medium"},
  {"text":"The 'good patient' role and adherence to medical advice is influenced by all EXCEPT:","options":["Patient's health literacy and understanding of the diagnosis and treatment plan","Patient's trust in and quality of communication with the healthcare provider","Genetic polymorphisms in the patient's CYP450 enzymes (these affect drug metabolism, not adherence behavior itself)","Social support and financial ability to afford medications and follow-up care"],"correct":2,"explanation":"Medication adherence (compliance) is influenced by: patient factors (beliefs about illness, health literacy, motivation), provider factors (communication quality, trust, shared decision-making), treatment factors (complexity, side effects, cost), and system factors (access, insurance). CYP450 polymorphisms affect drug metabolism and efficacy — they may affect whether a drug 'works' but are not a behavioral adherence factor. Social determinants of health strongly predict adherence.","tags":["sociology","medical sociology","adherence","health behavior"],"difficulty":"medium"}
]
